{
  "schema_version": 1,
  "as_of": "2026-11-01",
  "region": "us-east-2",
  "currency": "USD",
  "limits": {"product_usd": 8, "aggregate_usd": 15},
  "lines": [
    {
      "id": "fargate_vcpu_hours",
      "scope": "product",
      "service": "ECS Fargate",
      "description": "vCPU-hours of 0.25 vCPU tasks: 100 task-h cap (96 scheduled + 4 unit), 1 min minimum billing",
      "unit": "vCPU-hour",
      "unit_price_usd": 0.04048,
      "quantity": {"min": 12, "base": 24.5, "max": 25},
      "free_allowance": {"min": 0, "base": 0, "max": 0},
      "status": "verified",
      "max_basis": "cap",
      "source": {"url": "https://pricing.us-east-1.amazonaws.com/offers/v1.0/aws/AmazonECS/current/us-east-2/index.json", "term": "sku UGSJ89BUWB7SMJ6A USE2-Fargate-vCPU-Hours:perCPU"},
      "binding": "monthly_limit_hours*cpu/1024"
    },
    {
      "id": "fargate_memory_gb_hours",
      "scope": "product",
      "service": "ECS Fargate",
      "description": "GB-hours of 0.5 GB tasks over the same 100 task-h",
      "unit": "GB-hour",
      "unit_price_usd": 0.004445,
      "quantity": {"min": 24, "base": 49, "max": 50},
      "free_allowance": {"min": 0, "base": 0, "max": 0},
      "status": "verified",
      "max_basis": "cap",
      "source": {"url": "https://pricing.us-east-1.amazonaws.com/offers/v1.0/aws/AmazonECS/current/us-east-2/index.json", "term": "sku HH5EE3ZFWSFKGKWM USE2-Fargate-GB-Hours"},
      "binding": "monthly_limit_hours*memory/1024"
    },
    {
      "id": "public_ipv4_hours",
      "scope": "product",
      "service": "VPC",
      "description": "Ephemeral public IPv4 per task-hour (no NAT)",
      "unit": "address-hour",
      "unit_price_usd": 0.005,
      "quantity": {"min": 48, "base": 98, "max": 100},
      "free_allowance": {"min": 0, "base": 0, "max": 0},
      "status": "verified",
      "max_basis": "cap",
      "source": {"url": "https://pricing.us-east-1.amazonaws.com/offers/v1.0/aws/AmazonVPC/current/us-east-2/index.json", "term": "sku 8HFJK44D9234XNWA USE2-PublicIPv4:InUseAddress"},
      "binding": "monthly_limit_hours"
    },
    {
      "id": "cloudwatch_alarm_metrics",
      "scope": "product",
      "service": "CloudWatch",
      "description": "Standard-resolution alarm metrics counted from the root plan",
      "unit": "alarm-metric-month",
      "unit_price_usd": 0.1,
      "quantity": {"min": 25, "base": 25, "max": 25},
      "free_allowance": {"min": 10, "base": 10, "max": 0},
      "status": "verified",
      "max_basis": "cap",
      "source": {"url": "https://pricing.us-east-1.amazonaws.com/offers/v1.0/aws/AmazonCloudWatch/current/us-east-2/index.json", "term": "sku 28VSMYRVQXUWCTMA USE2-CW:AlarmMonitorUsage; free Global-CW:AlarmMonitorUsage 10"},
      "binding": "plan_alarm_metrics",
      "assumption": "Always-free 10 applied only to min and base; shared account allowance"
    },
    {
      "id": "cloudwatch_custom_metrics",
      "scope": "product",
      "service": "CloudWatch",
      "description": "Custom metrics produced by the processor metric filters",
      "unit": "metric-month",
      "unit_price_usd": 0.3,
      "quantity": {"min": 2, "base": 2, "max": 2},
      "free_allowance": {"min": 10, "base": 10, "max": 0},
      "status": "verified",
      "max_basis": "cap",
      "source": {"url": "https://pricing.us-east-1.amazonaws.com/offers/v1.0/aws/AmazonCloudWatch/current/us-east-2/index.json", "term": "sku XK7C3D2X45XTHURD USE2-CW:MetricMonitorUsage; free Global-CW:MetricMonitorUsage 10"},
      "binding": "plan_metric_filters",
      "assumption": "Always-free 10 applied only to min and base"
    },
    {
      "id": "cloudwatch_logs_ingestion",
      "scope": "product",
      "service": "CloudWatch Logs",
      "description": "Processor logs ingested, 7-day retention",
      "unit": "GB",
      "unit_price_usd": 0.5,
      "quantity": {"min": 0.05, "base": 0.1, "max": 0.2},
      "free_allowance": {"min": 5, "base": 5, "max": 0},
      "status": "verified",
      "max_basis": "hypothesis",
      "source": {"url": "https://pricing.us-east-1.amazonaws.com/offers/v1.0/aws/AmazonCloudWatch/current/us-east-2/index.json", "term": "sku 5T6Z6V26DSR7SZ49 USE2-DataProcessing-Bytes"},
      "assumption": "JSON log volume of 100 task-h"
    },
    {
      "id": "cloudwatch_logs_storage",
      "scope": "product",
      "service": "CloudWatch Logs",
      "description": "Retained log storage with 7-day retention",
      "unit": "GB-month",
      "unit_price_usd": 0.03,
      "quantity": {"min": 0.01, "base": 0.02, "max": 0.05},
      "free_allowance": {"min": 5, "base": 5, "max": 0},
      "status": "verified",
      "max_basis": "hypothesis",
      "source": {"url": "https://pricing.us-east-1.amazonaws.com/offers/v1.0/aws/AmazonCloudWatch/current/us-east-2/index.json", "term": "sku X7X4WD4A95NDR9U5 USE2-TimedStorage-ByteHrs"},
      "assumption": "Seven days of the ingested volume"
    },
    {
      "id": "lambda_requests",
      "scope": "product",
      "service": "Lambda",
      "description": "Cutoff Lambda invocations",
      "unit": "request",
      "unit_price_usd": 2e-07,
      "quantity": {"min": 10, "base": 20, "max": 100},
      "free_allowance": {"min": 1000000, "base": 1000000, "max": 0},
      "status": "verified",
      "max_basis": "hypothesis",
      "source": {"url": "https://pricing.us-east-1.amazonaws.com/offers/v1.0/aws/AWSLambda/current/us-east-2/index.json", "term": "sku ZEA64MMVK5QRB5TC USE2-Request; free ZQVCC2M69R4S79XS"},
      "assumption": "Cutoff fires at most a handful of times per month"
    },
    {
      "id": "lambda_compute",
      "scope": "product",
      "service": "Lambda",
      "description": "Cutoff Lambda compute at 128 MB",
      "unit": "GB-second",
      "unit_price_usd": 1.66667e-05,
      "quantity": {"min": 5, "base": 10, "max": 50},
      "free_allowance": {"min": 0, "base": 0, "max": 0},
      "status": "verified",
      "max_basis": "hypothesis",
      "source": {"url": "https://pricing.us-east-1.amazonaws.com/offers/v1.0/aws/AWSLambda/current/us-east-2/index.json", "term": "sku 3BYZH4NKJN8TJUQ6 USE2-Lambda-GB-Second"},
      "assumption": "Retries of a 30 s timeout at 128 MB"
    },
    {
      "id": "sns_requests",
      "scope": "product",
      "service": "SNS",
      "description": "Alarm and cutoff publishes",
      "unit": "request",
      "unit_price_usd": 5e-07,
      "quantity": {"min": 50, "base": 100, "max": 500},
      "free_allowance": {"min": 1000000, "base": 1000000, "max": 0},
      "status": "verified",
      "max_basis": "hypothesis",
      "source": {"url": "https://pricing.us-east-1.amazonaws.com/offers/v1.0/aws/AmazonSNS/current/us-east-2/index.json", "term": "sku X7V4MHE7G6GM98JT USE2-Requests-Tier1"},
      "assumption": "Alarm state changes per month"
    },
    {
      "id": "ecr_storage",
      "scope": "product",
      "service": "ECR",
      "description": "Private repository, at most 2 GB",
      "unit": "GB-month",
      "unit_price_usd": 0.1,
      "quantity": {"min": 0.5, "base": 1, "max": 2},
      "free_allowance": {"min": 0, "base": 0, "max": 0},
      "status": "verified",
      "max_basis": "cap",
      "source": {"url": "https://pricing.us-east-1.amazonaws.com/offers/v1.0/aws/AmazonECR/current/us-east-2/index.json", "term": "sku NA4VZMZUEQGMXP2Y USE2-TimedStorage-ByteHrs"}
    },
    {
      "id": "step_functions_transitions",
      "scope": "product",
      "service": "Step Functions",
      "description": "Standard transitions of at most 200 execution attempts",
      "unit": "transition",
      "unit_price_usd": 2.5e-05,
      "quantity": {"min": 500, "base": 2000, "max": 4000},
      "free_allowance": {"min": 4000, "base": 4000, "max": 0},
      "status": "verified",
      "max_basis": "hypothesis",
      "source": {"url": "https://pricing.us-east-1.amazonaws.com/offers/v1.0/aws/AmazonStates/current/us-east-2/index.json", "term": "sku PEWNRD5EMPQPHCAQ USE2-StateTransition; free DCMZZXP5RBUG8FGP 4000"},
      "binding": "monthly_attempt_limit=200",
      "assumption": "At most 20 transitions per attempt"
    },
    {
      "id": "dynamodb_read_units",
      "scope": "product",
      "service": "DynamoDB",
      "description": "On-demand read request units",
      "unit": "read-request-unit",
      "unit_price_usd": 1.25e-07,
      "quantity": {"min": 100000, "base": 300000, "max": 500000},
      "free_allowance": {"min": 0, "base": 0, "max": 0},
      "status": "verified",
      "max_basis": "hypothesis",
      "source": {"url": "https://pricing.us-east-1.amazonaws.com/offers/v1.0/aws/AmazonDynamoDB/current/us-east-2/index.json", "term": "sku SGMZJPDKSWXTY4VE USE2-ReadRequestUnits"},
      "assumption": "Control plane reads of a pilot tenant"
    },
    {
      "id": "dynamodb_write_units",
      "scope": "product",
      "service": "DynamoDB",
      "description": "On-demand write request units",
      "unit": "write-request-unit",
      "unit_price_usd": 6.25e-07,
      "quantity": {"min": 20000, "base": 50000, "max": 100000},
      "free_allowance": {"min": 0, "base": 0, "max": 0},
      "status": "verified",
      "max_basis": "hypothesis",
      "source": {"url": "https://pricing.us-east-1.amazonaws.com/offers/v1.0/aws/AmazonDynamoDB/current/us-east-2/index.json", "term": "sku GGQSXTNTRBHRVS56 USE2-WriteRequestUnits"},
      "assumption": "Control plane writes of a pilot tenant"
    },
    {
      "id": "dynamodb_pitr_storage",
      "scope": "product",
      "service": "DynamoDB",
      "description": "Point-in-time recovery storage",
      "unit": "GB-month",
      "unit_price_usd": 0.2,
      "quantity": {"min": 0.02, "base": 0.05, "max": 0.1},
      "free_allowance": {"min": 0, "base": 0, "max": 0},
      "status": "verified",
      "max_basis": "hypothesis",
      "source": {"url": "https://pricing.us-east-1.amazonaws.com/offers/v1.0/aws/AmazonDynamoDB/current/us-east-2/index.json", "term": "sku SU36MES57K2M6EHQ USE2-TimedPITRStorage-ByteHrs"},